<?xml version="1.0" encoding="UTF-8"?>
<!DOCTYPE relationships SYSTEM "relationship-types.dtd">

<relationships>
    <type>
        <leftType>Person</leftType>
        <rightType>Person</rightType>
        <leftwardType>isCorrectionOfItem</leftwardType>
        <rightwardType>isCorrectedByItem</rightwardType>
        <leftCardinality>
            <min>0</min>
	    <max>1</max>
        </leftCardinality>
        <rightCardinality>
            <min>0</min>
	    <max>1</max>
        </rightCardinality>
    </type>
    <type>
        <leftType>Project</leftType>
        <rightType>Project</rightType>
        <leftwardType>isCorrectionOfItem</leftwardType>
        <rightwardType>isCorrectedByItem</rightwardType>
        <leftCardinality>
            <min>0</min>
	    <max>1</max>
        </leftCardinality>
        <rightCardinality>
            <min>0</min>
	    <max>1</max>
        </rightCardinality>
    </type>
    <type>
        <leftType>Funding</leftType>
        <rightType>Funding</rightType>
        <leftwardType>isCorrectionOfItem</leftwardType>
        <rightwardType>isCorrectedByItem</rightwardType>
        <leftCardinality>
            <min>0</min>
	    <max>1</max>
        </leftCardinality>
        <rightCardinality>
            <min>0</min>
	    <max>1</max>
        </rightCardinality>
    </type>
    <type>
        <leftType>OrgUnit</leftType>
        <rightType>OrgUnit</rightType>
        <leftwardType>isCorrectionOfItem</leftwardType>
        <rightwardType>isCorrectedByItem</rightwardType>
        <leftCardinality>
            <min>0</min>
	    <max>1</max>
        </leftCardinality>
        <rightCardinality>
            <min>0</min>
	    <max>1</max>
        </rightCardinality>
    </type>
    <type>
        <leftType>Journal</leftType>
        <rightType>Journal</rightType>
        <leftwardType>isCorrectionOfItem</leftwardType>
        <rightwardType>isCorrectedByItem</rightwardType>
        <leftCardinality>
            <min>0</min>
	    <max>1</max>
        </leftCardinality>
        <rightCardinality>
            <min>0</min>
	    <max>1</max>
        </rightCardinality>
    </type>
    <type>
        <leftType>Publication</leftType>
        <rightType>Publication</rightType>
        <leftwardType>isCorrectionOfItem</leftwardType>
        <rightwardType>isCorrectedByItem</rightwardType>
        <leftCardinality>
            <min>0</min>
	    <max>1</max>
        </leftCardinality>
        <rightCardinality>
            <min>0</min>
	    <max>1</max>
        </rightCardinality>
    </type>
    <type>
        <leftType>Patent</leftType>
        <rightType>Patent</rightType>
        <leftwardType>isCorrectionOfItem</leftwardType>
        <rightwardType>isCorrectedByItem</rightwardType>
        <leftCardinality>
            <min>0</min>
	    <max>1</max>
        </leftCardinality>
        <rightCardinality>
            <min>0</min>
	    <max>1</max>
        </rightCardinality>
    </type>
    <type>
        <leftType>Dataset</leftType>
        <rightType>Dataset</rightType>
        <leftwardType>isCorrectionOfItem</leftwardType>
        <rightwardType>isCorrectedByItem</rightwardType>
        <leftCardinality>
            <min>0</min>
	    <max>1</max>
        </leftCardinality>
        <rightCardinality>
            <min>0</min>
	    <max>1</max>
        </rightCardinality>
    </type>
    <type>
        <leftType>Event</leftType>
        <rightType>Event</rightType>
        <leftwardType>isCorrectionOfItem</leftwardType>
        <rightwardType>isCorrectedByItem</rightwardType>
        <leftCardinality>
            <min>0</min>
	    <max>1</max>
        </leftCardinality>
        <rightCardinality>
            <min>0</min>
	    <max>1</max>
        </rightCardinality>
    </type>
    <type>
        <leftType>Equipment</leftType>
        <rightType>Equipment</rightType>
        <leftwardType>isCorrectionOfItem</leftwardType>
        <rightwardType>isCorrectedByItem</rightwardType>
        <leftCardinality>
            <min>0</min>
	    <max>1</max>
        </leftCardinality>
        <rightCardinality>
            <min>0</min>
	    <max>1</max>
        </rightCardinality>
    </type>
    
</relationships>