<?xml version="1.0" encoding="UTF-8"?>
<!DOCTYPE relationships SYSTEM "relationship-types.dtd">

<relationships>

	<!-- Sample relationship types setup used for the entities development
	 This file can be imported using the initialize-entities launcher -->
    <type>
        <leftType>Publication</leftType>
        <rightType>Person</rightType>
        <leftwardType>isAuthorOfPublication</leftwardType>
        <rightwardType>isPublicationOfAuthor</rightwardType>
        <leftCardinality>
            <min>0</min>
        </leftCardinality>
        <rightCardinality>
            <min>0</min>
        </rightCardinality>
        <copyToLeft>true</copyToLeft>
    </type>
    <type>
        <leftType>Publication</leftType>
        <rightType>Person</rightType>
        <leftwardType>isEditorOfPublication</leftwardType>
        <rightwardType>isPublicationOfEditor</rightwardType>
        <leftCardinality>
            <min>0</min>
        </leftCardinality>
        <rightCardinality>
            <min>0</min>
        </rightCardinality>
        <copyToLeft>true</copyToLeft>
    </type>
    <type>
        <leftType>Publication</leftType>
        <rightType>Project</rightType>
        <leftwardType>isProjectOfPublication</leftwardType>
        <rightwardType>isPublicationOfProject</rightwardType>
        <leftCardinality>
            <min>0</min>
        </leftCardinality>
        <rightCardinality>
            <min>0</min>
        </rightCardinality>
        <copyToLeft>true</copyToLeft>
    </type>
    <type>
        <leftType>Publication</leftType>
        <rightType>OrgUnit</rightType>
        <leftwardType>isOrgUnitOfPublication</leftwardType>
        <rightwardType>isPublicationOfOrgUnit</rightwardType>
        <leftCardinality>
            <min>0</min>
        </leftCardinality>
        <rightCardinality>
            <min>0</min>
        </rightCardinality>
        <copyToLeft>true</copyToLeft>
    </type>
    <type>
        <leftType>Person</leftType>
        <rightType>Project</rightType>
        <leftwardType>isProjectOfPerson</leftwardType>
        <rightwardType>isPersonOfProject</rightwardType>
        <leftCardinality>
            <min>0</min>
        </leftCardinality>
        <rightCardinality>
            <min>0</min>
        </rightCardinality>
    </type>
    <type>
        <leftType>Person</leftType>
        <rightType>OrgUnit</rightType>
        <leftwardType>isOrgUnitOfPerson</leftwardType>
        <rightwardType>isPersonOfOrgUnit</rightwardType>
        <leftCardinality>
            <min>0</min>
        </leftCardinality>
        <rightCardinality>
            <min>0</min>
        </rightCardinality>
    </type>
    <type>
        <leftType>Project</leftType>
        <rightType>OrgUnit</rightType>
        <leftwardType>isOrgUnitOfProject</leftwardType>
        <rightwardType>isProjectOfOrgUnit</rightwardType>
        <leftCardinality>
            <min>0</min>
        </leftCardinality>
        <rightCardinality>
            <min>0</min>
        </rightCardinality>
    </type>
    <type>
        <leftType>Journal</leftType>
        <rightType>JournalVolume</rightType>
        <leftwardType>isVolumeOfJournal</leftwardType>
        <rightwardType>isJournalOfVolume</rightwardType>
        <leftCardinality>
            <min>0</min>
        </leftCardinality>
        <rightCardinality>
            <min>0</min>
        </rightCardinality>
    </type>
    <type>
        <leftType>JournalVolume</leftType>
        <rightType>JournalIssue</rightType>
        <leftwardType>isIssueOfJournalVolume</leftwardType>
        <rightwardType>isJournalVolumeOfIssue</rightwardType>
        <leftCardinality>
            <min>0</min>
        </leftCardinality>
        <rightCardinality>
            <min>0</min>
        </rightCardinality>
    </type>
    <type>
        <leftType>Publication</leftType>
        <rightType>OrgUnit</rightType>
        <leftwardType>isAuthorOfPublication</leftwardType>
        <rightwardType>isPublicationOfAuthor</rightwardType>
        <leftCardinality>
            <min>0</min>
        </leftCardinality>
        <rightCardinality>
            <min>0</min>
        </rightCardinality>
        <copyToLeft>true</copyToLeft>
    </type>
    <type>
        <leftType>Publication</leftType>
        <rightType>OrgUnit</rightType>
        <leftwardType>isEditorOfPublication</leftwardType>
        <rightwardType>isPublicationOfEditor</rightwardType>
        <leftCardinality>
            <min>0</min>
        </leftCardinality>
        <rightCardinality>
            <min>0</min>
        </rightCardinality>
        <copyToLeft>true</copyToLeft>
    </type>
    <type>
        <leftType>JournalIssue</leftType>
        <rightType>Publication</rightType>
        <leftwardType>isPublicationOfJournalIssue</leftwardType>
        <rightwardType>isJournalIssueOfPublication</rightwardType>
        <leftCardinality>
            <min>0</min>
        </leftCardinality>
        <rightCardinality>
            <min>0</min>
        </rightCardinality>
        <copyToRight>true</copyToRight>
    </type>
    <type>
        <leftType>Dataset</leftType>
        <rightType>Person</rightType>
        <leftwardType>isAuthorOfDataset</leftwardType>
        <rightwardType>isDatasetOfAuthor</rightwardType>
        <leftCardinality>
            <min>0</min>
        </leftCardinality>
        <rightCardinality>
            <min>0</min>
        </rightCardinality>
        <copyToLeft>true</copyToLeft>
    </type>
    <type>
        <leftType>Dataset</leftType>
        <rightType>Project</rightType>
        <leftwardType>isProjectOfDataset</leftwardType>
        <rightwardType>isDatasetOfProject</rightwardType>
        <leftCardinality>
            <min>0</min>
        </leftCardinality>
        <rightCardinality>
            <min>0</min>
        </rightCardinality>
        <copyToLeft>true</copyToLeft>
    </type>
    <type>
        <leftType>Dataset</leftType>
        <rightType>OrgUnit</rightType>
        <leftwardType>isAuthorOfDataset</leftwardType>
        <rightwardType>isDatasetOfAuthor</rightwardType>
        <leftCardinality>
            <min>0</min>
        </leftCardinality>
        <rightCardinality>
            <min>0</min>
        </rightCardinality>
        <copyToLeft>true</copyToLeft>
    </type>
    <type>
        <leftType>Dataset</leftType>
        <rightType>OrgUnit</rightType>
        <leftwardType>isOrgUnitOfDataset</leftwardType>
        <rightwardType>isDatasetOfOrgUnit</rightwardType>
        <leftCardinality>
            <min>0</min>
        </leftCardinality>
        <rightCardinality>
            <min>0</min>
        </rightCardinality>
        <copyToLeft>true</copyToLeft>
    </type>
    <type>
        <leftType>Dataset</leftType>
        <rightType>Publication</rightType>
        <leftwardType>isPublicationOfDataset</leftwardType>
        <rightwardType>isDatasetOfPublication</rightwardType>
        <leftCardinality>
            <min>0</min>
        </leftCardinality>
        <rightCardinality>
            <min>0</min>
        </rightCardinality>
        <copyToLeft>true</copyToLeft>
        <copyToRight>true</copyToRight>
    </type>
    <type>
        <leftType>Funding</leftType>
        <rightType>Project</rightType>
        <leftwardType>isProjectOfFunding</leftwardType>
        <rightwardType>isFundingOfProject</rightwardType>
        <leftCardinality>
            <min>0</min>
        </leftCardinality>
        <rightCardinality>
            <min>0</min>
        </rightCardinality>
        <copyToLeft>true</copyToLeft>
        <copyToRight>true</copyToRight>
    </type>
    <type>
        <leftType>Funding</leftType>
        <rightType>OrgUnit</rightType>
        <leftwardType>isOrgUnitOfFunding</leftwardType>
        <rightwardType>isFundingOfOrgUnit</rightwardType>
        <leftCardinality>
            <min>0</min>
        </leftCardinality>
        <rightCardinality>
            <min>0</min>
        </rightCardinality>
        <copyToLeft>true</copyToLeft>
        <copyToRight>true</copyToRight>
    </type>
    <type>
        <leftType>Funding</leftType>
        <rightType>Publication</rightType>
        <leftwardType>isPublicationOfFunding</leftwardType>
        <rightwardType>isFundingOfPublication</rightwardType>
        <leftCardinality>
            <min>0</min>
        </leftCardinality>
        <rightCardinality>
            <min>0</min>
        </rightCardinality>
        <copyToLeft>true</copyToLeft>
        <copyToRight>true</copyToRight>
    </type>
    <type>
        <leftType>Funding</leftType>
        <rightType>Person</rightType>
        <leftwardType>isInvestigatorOfFunding</leftwardType>
        <rightwardType>isFundingOfInvestigator</rightwardType>
        <leftCardinality>
            <min>0</min>
        </leftCardinality>
        <rightCardinality>
            <min>0</min>
        </rightCardinality>
    </type>
    <type>
        <leftType>Funding</leftType>
        <rightType>Funding</rightType>
        <leftwardType>isFundingOfFunding</leftwardType>
        <rightwardType>isFundingProgrammeOf</rightwardType>
        <leftCardinality>
            <min>0</min>
        </leftCardinality>
        <rightCardinality>
            <min>0</min>
        </rightCardinality>
    </type>
</relationships>
